{
  "contract": "decision_sandbox_execution_request",
  "schema_version": "1.0.0",
  "execution_id": "sandbox-fixture-execution-0001",
  "policy": {
    "policy_id": "ai-lab-decision-sandbox-fixture-policy",
    "policy_version": "1.0.0",
    "policy_hash": "6bad0bd18d779acb838ecf37e561d1678b13f0b53649acf40810972b03bc8378"
  },
  "subject": {
    "subject_kind": "synthetic_fixture_adapter",
    "adapter_id": "ai-lab-synthetic-decision-fixture-adapter",
    "adapter_version": "1.0.0",
    "artifact_sha256": "9fbc93fefa4d65d762424b8b3ccc4bf9da981f3c4561795720ee47fb5767a3c5",
    "protocol_version": "1.0.0"
  },
  "request": {
    "contract": "typed_decision_request",
    "schema_version": "1.0.0",
    "request_id": "synthetic-evidence-sufficiency-request-0001",
    "capability_id": "synthetic.decision.evidence_sufficiency_assess",
    "execution_paradigm": "typed_decision",
    "decision_type": "boolean",
    "bounded_state": {
      "facts": [
        {
          "fact_id": "packet.claim_count",
          "value_type": "integer",
          "value": 3
        },
        {
          "fact_id": "packet.cited_claim_count",
          "value_type": "integer",
          "value": 3
        }
      ]
    },
    "question": {
      "question_id": "synthetic.evidence.sufficient",
      "text": "Does every claim in this synthetic packet cite at least one declared evidence reference?"
    },
    "output_domain": {
      "kind": "boolean"
    },
    "policy": {
      "data_classification": "internal",
      "human_review_required": true,
      "abstention_permitted": true,
      "escalation_policy_ref": null,
      "downstream_use": "none"
    },
    "evidence_refs": [
      {
        "evidence_id": "synthetic-fixture-packet-0001",
        "content_hash": "bbbbbbbbbbbbbbbbbbbbbbbbbbbbbbbbbbbbbbbbbbbbbbbbbbbbbbbbbbbbbbbb"
      }
    ]
  },
  "request_hash": "0eaa461b53efe3d593695a90711746228877bc2432c744a4a8cd0d4742451598",
  "output_authority": "none"
}
